Peru,"{Peru}","{Peru}","{Peru}","{Peru}","{Peru}","{Peru}","{Peru}","{Peru}","{Peru}","{Peru}","{Peru}","{Peru}","{Peru}","{Peru}","{Peru}","{Peru}","{Peru}","{Peru}","{Peru}","{Peru}","{Peru}","{Peru}","{Peru}","{Peru}","{Peru}","{Peru}","{Peru}","{Peru}","{Peru}","{Mexico, France, Poland, Yugoslavia, India, Honduras, Haiti, Portugal, Italy, Philippines, Puerto-Rico, Cuba, Trinadad&Tobago, Cambodia, Guatemala, El-Salvador, Thailand, Iran, Germany, Holand-Netherlands, England, Vietnam, Japan, Dominican-Republic, Canada, Peru, Ireland, Nicaragua, Greece, ?, Outlying-US(Guam-USVI-etc), Columbia}","{Mexico, France, Poland, Yugoslavia, India, Honduras, Haiti, Portugal, Jamaica, Italy, Philippines, Puerto-Rico, Cuba, Trinadad&Tobago, Cambodia, Guatemala, El-Salvador, Thailand, Iran, Germany, Holand-Netherlands, England, Vietnam, Japan, Dominican-Republic, Canada, Peru, Ireland, Nicaragua, Greece, ?, Outlying-US(Guam-USVI-etc), Columbia}","{Mexico, France, Poland, Yugoslavia, India, Honduras, Haiti, Portugal, Jamaica, Italy, Philippines, Puerto-Rico, Cuba, Trinadad&Tobago, Cambodia, Guatemala, El-Salvador, Thailand, Hungary, Iran, Germany, Holand-Netherlands, England, Vietnam, Japan, Dominican-Republic, Canada, Peru, Ireland, Nicaragua, Greece, ?, Outlying-US(Guam-USVI-etc), Columbia}","{Mexico, France, Poland, Yugoslavia, India, Honduras, Haiti, Portugal, Jamaica, Italy, Philippines, Puerto-Rico, Cuba, Trinadad&Tobago, Cambodia, Guatemala, El-Salvador, Thailand, Ecuador, Hungary, Iran, Germany, Holand-Netherlands, England, Vietnam, Japan, Dominican-Republic, Canada, Peru, Ireland, Nicaragua, Greece, ?, Outlying-US(Guam-USVI-etc), Columbia}","{Mexico, France, Poland, Yugoslavia, India, Honduras, Haiti, Portugal, Jamaica, Italy, Philippines, Puerto-Rico, Cuba, Trinadad&Tobago, Cambodia, Guatemala, El-Salvador, Scotland, Thailand, Ecuador, Hungary, Iran, Germany, Holand-Netherlands, England, Vietnam, Japan, Dominican-Republic, Canada, Peru, Ireland, Nicaragua, Greece, ?, Outlying-US(Guam-USVI-etc), Columbia}","{Mexico, France, Poland, Yugoslavia, India, Taiwan, Haiti, Portugal, Honduras, Jamaica, Italy, Philippines, Puerto-Rico, Cuba, Trinadad&Tobago, Cambodia, Guatemala, El-Salvador, Scotland, Thailand, Ecuador, Hungary, Iran, Germany, Holand-Netherlands, England, Vietnam, Japan, Dominican-Republic, Canada, Peru, Ireland, Nicaragua, Greece, ?, Outlying-US(Guam-USVI-etc), Columbia}","{Mexico, France, Poland, Yugoslavia, India, Taiwan, Haiti, Portugal, Honduras, Jamaica, Italy, Philippines, Puerto-Rico, Cuba, Trinadad&Tobago, Cambodia, Guatemala, El-Salvador, Scotland, Thailand, Ecuador, Hungary, Iran, Germany, Holand-Netherlands, England, Vietnam, Laos, Japan, Dominican-Republic, Canada, Peru, Ireland, Nicaragua, Greece, ?, Outlying-US(Guam-USVI-etc), Columbia}","{Mexico, France, Poland, Yugoslavia, India, Taiwan, Haiti, Portugal, Honduras, Jamaica, Italy, Philippines, Puerto-Rico, Cuba, Trinadad&Tobago, United-States, Cambodia, Guatemala, El-Salvador, Scotland, Thailand, Ecuador, Hungary, Iran, Germany, Holand-Netherlands, England, Vietnam, Laos, Japan, Dominican-Republic, Canada, Peru, Ireland, Nicaragua, Greece, ?, Outlying-US(Guam-USVI-etc), Columbia}","{Mexico, France, Poland, Yugoslavia, India, Taiwan, Haiti, Portugal, Honduras, Jamaica, Italy, Philippines, Puerto-Rico, China, Cuba, Trinadad&Tobago, United-States, Cambodia, Guatemala, El-Salvador, Scotland, Thailand, Ecuador, Hungary, Iran, Germany, Holand-Netherlands, England, Vietnam, Laos, Japan, Dominican-Republic, Canada, Peru, Ireland, Nicaragua, Greece, ?, Outlying-US(Guam-USVI-etc), Columbia}","{Mexico, France, Poland, Yugoslavia, India, Taiwan, Haiti, Portugal, Honduras, Jamaica, Italy, Philippines, Puerto-Rico, China, Cuba, Trinadad&Tobago, United-States, Cambodia, Guatemala, El-Salvador, Scotland, Thailand, Ecuador, Hungary, Iran, Germany, Holand-Netherlands, England, Vietnam, Laos, Japan, Dominican-Republic, Canada, Hong, Peru, Ireland, Nicaragua, Greece, ?, Outlying-US(Guam-USVI-etc), Columbia}",*,*
Taiwan,"{Taiwan}","{Taiwan}","{Taiwan}","{Taiwan}","{Taiwan}","{Taiwan}","{Taiwan}","{Taiwan}","{Taiwan}","{Taiwan}","{Taiwan}","{Taiwan}","{Taiwan}","{Taiwan}","{Taiwan}","{Taiwan}","{Taiwan}","{Taiwan}","{Taiwan}","{Taiwan}","{Taiwan}","{Taiwan}","{Taiwan}","{Taiwan}","{Taiwan}","{Taiwan}","{Taiwan}","{Taiwan}","{Taiwan}","{Taiwan}","{Taiwan}","{Taiwan}","{Taiwan}","{Taiwan}","{Mexico, France, Poland, Yugoslavia, India, Taiwan, Haiti, Portugal, Honduras, Jamaica, Italy, Philippines, Puerto-Rico, Cuba, Trinadad&Tobago, Cambodia, Guatemala, El-Salvador, Scotland, Thailand, Ecuador, Hungary, Iran, Germany, Holand-Netherlands, England, Vietnam, Japan, Dominican-Republic, Canada, Peru, Ireland, Nicaragua, Greece, ?, Outlying-US(Guam-USVI-etc), Columbia}","{Mexico, France, Poland, Yugoslavia, India, Taiwan, Haiti, Portugal, Honduras, Jamaica, Italy, Philippines, Puerto-Rico, Cuba, Trinadad&Tobago, Cambodia, Guatemala, El-Salvador, Scotland, Thailand, Ecuador, Hungary, Iran, Germany, Holand-Netherlands, England, Vietnam, Laos, Japan, Dominican-Republic, Canada, Peru, Ireland, Nicaragua, Greece, ?, Outlying-US(Guam-USVI-etc), Columbia}","{Mexico, France, Poland, Yugoslavia, India, Taiwan, Haiti, Portugal, Honduras, Jamaica, Italy, Philippines, Puerto-Rico, Cuba, Trinadad&Tobago, United-States, Cambodia, Guatemala, El-Salvador, Scotland, Thailand, Ecuador, Hungary, Iran, Germany, Holand-Netherlands, England, Vietnam, Laos, Japan, Dominican-Republic, Canada, Peru, Ireland, Nicaragua, Greece, ?, Outlying-US(Guam-USVI-etc), Columbia}","{Mexico, France, Poland, Yugoslavia, India, Taiwan, Haiti, Portugal, Honduras, Jamaica, Italy, Philippines, Puerto-Rico, China, Cuba, Trinadad&Tobago, United-States, Cambodia, Guatemala, El-Salvador, Scotland, Thailand, Ecuador, Hungary, Iran, Germany, Holand-Netherlands, England, Vietnam, Laos, Japan, Dominican-Republic, Canada, Peru, Ireland, Nicaragua, Greece, ?, Outlying-US(Guam-USVI-etc), Columbia}","{Mexico, France, Poland, Yugoslavia, India, Taiwan, Haiti, Portugal, Honduras, Jamaica, Italy, Philippines, Puerto-Rico, China, Cuba, Trinadad&Tobago, United-States, Cambodia, Guatemala, El-Salvador, Scotland, Thailand, Ecuador, Hungary, Iran, Germany, Holand-Netherlands, England, Vietnam, Laos, Japan, Dominican-Republic, Canada, Hong, Peru, Ireland, Nicaragua, Greece, ?, Outlying-US(Guam-USVI-etc), Columbia}",*,*
United-States,"{United-States}","{United-States}","{United-States}","{United-States}","{United-States}","{United-States}","{United-States}","{United-States}","{United-States}","{United-States}","{United-States}","{United-States}","{United-States}","{United-States}","{United-States}","{United-States}","{United-States}","{United-States}","{United-States}","{United-States}","{United-States}","{United-States}","{United-States}","{United-States}","{United-States}","{United-States}","{United-States}","{United-States}","{United-States}","{United-States}","{United-States}","{United-States}","{United-States}","{United-States}","{United-States}","{United-States}","{Mexico, France, Poland, Yugoslavia, India, Taiwan, Haiti, Portugal, Honduras, Jamaica, Italy, Philippines, Puerto-Rico, Cuba, Trinadad&Tobago, United-States, Cambodia, Guatemala, El-Salvador, Scotland, Thailand, Ecuador, Hungary, Iran, Germany, Holand-Netherlands, England, Vietnam, Laos, Japan, Dominican-Republic, Canada, Peru, Ireland, Nicaragua, Greece, ?, Outlying-US(Guam-USVI-etc), Columbia}","{Mexico, France, Poland, Yugoslavia, India, Taiwan, Haiti, Portugal, Honduras, Jamaica, Italy, Philippines, Puerto-Rico, China, Cuba, Trinadad&Tobago, United-States, Cambodia, Guatemala, El-Salvador, Scotland, Thailand, Ecuador, Hungary, Iran, Germany, Holand-Netherlands, England, Vietnam, Laos, Japan, Dominican-Republic, Canada, Peru, Ireland, Nicaragua, Greece, ?, Outlying-US(Guam-USVI-etc), Columbia}","{Mexico, France, Poland, Yugoslavia, India, Taiwan, Haiti, Portugal, Honduras, Jamaica, Italy, Philippines, Puerto-Rico, China, Cuba, Trinadad&Tobago, United-States, Cambodia, Guatemala, El-Salvador, Scotland, Thailand, Ecuador, Hungary, Iran, Germany, Holand-Netherlands, England, Vietnam, Laos, Japan, Dominican-Republic, Canada, Hong, Peru, Ireland, Nicaragua, Greece, ?, Outlying-US(Guam-USVI-etc), Columbia}",*,*
Italy,"{Italy}","{Italy}","{Italy}","{Italy}","{Italy}","{Italy}","{Italy}","{Italy}","{Italy}","{Italy}","{Italy}","{Italy}","{Italy}","{Italy}","{Italy}","{Italy}","{Italy}","{Mexico, Poland, Yugoslavia, Honduras, Portugal, Italy, Puerto-Rico, Cuba, Trinadad&Tobago, Cambodia, Guatemala, El-Salvador, Germany, Holand-Netherlands, England, Dominican-Republic, Nicaragua, Greece, ?, Outlying-US(Guam-USVI-etc)}","{Mexico, France, Poland, Yugoslavia, Honduras, Portugal, Italy, Puerto-Rico, Cuba, Trinadad&Tobago, Cambodia, Guatemala, El-Salvador, Germany, Holand-Netherlands, England, Dominican-Republic, Nicaragua, Greece, ?, Outlying-US(Guam-USVI-etc)}","{Mexico, France, Poland, Yugoslavia, Honduras, Portugal, Italy, Puerto-Rico, Cuba, Trinadad&Tobago, Cambodia, Guatemala, El-Salvador, Thailand, Germany, Holand-Netherlands, England, Dominican-Republic, Nicaragua, Greece, ?, Outlying-US(Guam-USVI-etc)}","{Mexico, France, Poland, Yugoslavia, India, Honduras, Portugal, Italy, Puerto-Rico, Cuba, Trinadad&Tobago, Cambodia, Guatemala, El-Salvador, Thailand, Germany, Holand-Netherlands, England, Dominican-Republic, Nicaragua, Greece, ?, Outlying-US(Guam-USVI-etc)}","{Mexico, France, Poland, Yugoslavia, India, Honduras, Portugal, Italy, Puerto-Rico, Cuba, Trinadad&Tobago, Cambodia, Guatemala, El-Salvador, Thailand, Germany, Holand-Netherlands, England, Dominican-Republic, Canada, Nicaragua, Greece, ?, Outlying-US(Guam-USVI-etc)}","{Mexico, France, Poland, Yugoslavia, India, Honduras, Portugal, Italy, Puerto-Rico, Cuba, Trinadad&Tobago, Cambodia, Guatemala, El-Salvador, Thailand, Germany, Holand-Netherlands, England, Dominican-Republic, Canada, Ireland, Nicaragua, Greece, ?, Outlying-US(Guam-USVI-etc)}","{Mexico, France, Poland, Yugoslavia, India, Honduras, Portugal, Italy, Philippines, Puerto-Rico, Cuba, Trinadad&Tobago, Cambodia, Guatemala, El-Salvador, Thailand, Germany, Holand-Netherlands, England, Dominican-Republic, Canada, Ireland, Nicaragua, Greece, ?, Outlying-US(Guam-USVI-etc)}","{Mexico, France, Poland, Yugoslavia, India, Honduras, Portugal, Italy, Philippines, Puerto-Rico, Cuba, Trinadad&Tobago, Cambodia, Guatemala, El-Salvador, Thailand, Germany, Holand-Netherlands, England, Vietnam, Dominican-Republic, Canada, Ireland, Nicaragua, Greece, ?, Outlying-US(Guam-USVI-etc)}","{Mexico, France, Poland, Yugoslavia, India, Honduras, Portugal, Italy, Philippines, Puerto-Rico, Cuba, Trinadad&Tobago, Cambodia, Guatemala, El-Salvador, Thailand, Germany, Holand-Netherlands, England, Vietnam, Japan, Dominican-Republic, Canada, Ireland, Nicaragua, Greece, ?, Outlying-US(Guam-USVI-etc)}","{Mexico, France, Poland, Yugoslavia, India, Honduras, Portugal, Italy, Philippines, Puerto-Rico, Cuba, Trinadad&Tobago, Cambodia, Guatemala, El-Salvador, Thailand, Iran, Germany, Holand-Netherlands, England, Vietnam, Japan, Dominican-Republic, Canada, Ireland, Nicaragua, Greece, ?, Outlying-US(Guam-USVI-etc)}","{Mexico, France, Poland, Yugoslavia, India, Honduras, Portugal, Italy, Philippines, Puerto-Rico, Cuba, Trinadad&Tobago, Cambodia, Guatemala, El-Salvador, Thailand, Iran, Germany, Holand-Netherlands, England, Vietnam, Japan, Dominican-Republic, Canada, Ireland, Nicaragua, Greece, ?, Outlying-US(Guam-USVI-etc), Columbia}","{Mexico, France, Poland, Yugoslavia, India, Honduras, Haiti, Portugal, Italy, Philippines, Puerto-Rico, Cuba, Trinadad&Tobago, Cambodia, Guatemala, El-Salvador, Thailand, Iran, Germany, Holand-Netherlands, England, Vietnam, Japan, Dominican-Republic, Canada, Ireland, Nicaragua, Greece, ?, Outlying-US(Guam-USVI-etc), Columbia}","{Mexico, France, Poland, Yugoslavia, India, Honduras, Haiti, Portugal, Italy, Philippines, Puerto-Rico, Cuba, Trinadad&Tobago, Cambodia, Guatemala, El-Salvador, Thailand, Iran, Germany, Holand-Netherlands, England, Vietnam, Japan, Dominican-Republic, Canada, Peru, Ireland, Nicaragua, Greece, ?, Outlying-US(Guam-USVI-etc), Columbia}","{Mexico, France, Poland, Yugoslavia, India, Honduras, Haiti, Portugal, Jamaica, Italy, Philippines, Puerto-Rico, Cuba, Trinadad&Tobago, Cambodia, Guatemala, El-Salvador, Thailand, Iran, Germany, Holand-Netherlands, England, Vietnam, Japan, Dominican-Republic, Canada, Peru, Ireland, Nicaragua, Greece, ?, Outlying-US(Guam-USVI-etc), Columbia}","{Mexico, France, Poland, Yugoslavia, India, Honduras, Haiti, Portugal, Jamaica, Italy, Philippines, Puerto-Rico, Cuba, Trinadad&Tobago, Cambodia, Guatemala, El-Salvador, Thailand, Hungary, Iran, Germany, Holand-Netherlands, England, Vietnam, Japan, Dominican-Republic, Canada, Peru, Ireland, Nicaragua, Greece, ?, Outlying-US(Guam-USVI-etc), Columbia}","{Mexico, France, Poland, Yugoslavia, India, Honduras, Haiti, Portugal, Jamaica, Italy, Philippines, Puerto-Rico, Cuba, Trinadad&Tobago, Cambodia, Guatemala, El-Salvador, Thailand, Ecuador, Hungary, Iran, Germany, Holand-Netherlands, England, Vietnam, Japan, Dominican-Republic, Canada, Peru, Ireland, Nicaragua, Greece, ?, Outlying-US(Guam-USVI-etc), Columbia}","{Mexico, France, Poland, Yugoslavia, India, Honduras, Haiti, Portugal, Jamaica, Italy, Philippines, Puerto-Rico, Cuba, Trinadad&Tobago, Cambodia, Guatemala, El-Salvador, Scotland, Thailand, Ecuador, Hungary, Iran, Germany, Holand-Netherlands, England, Vietnam, Japan, Dominican-Republic, Canada, Peru, Ireland, Nicaragua, Greece, ?, Outlying-US(Guam-USVI-etc), Columbia}","{Mexico, France, Poland, Yugoslavia, India, Taiwan, Haiti, Portugal, Honduras, Jamaica, Italy, Philippines, Puerto-Rico, Cuba, Trinadad&Tobago, Cambodia, Guatemala, El-Salvador, Scotland, Thailand, Ecuador, Hungary, Iran, Germany, Holand-Netherlands, England, Vietnam, Japan, Dominican-Republic, Canada, Peru, Ireland, Nicaragua, Greece, ?, Outlying-US(Guam-USVI-etc), Columbia}","{Mexico, France, Poland, Yugoslavia, India, Taiwan, Haiti, Portugal, Honduras, Jamaica, Italy, Philippines, Puerto-Rico, Cuba, Trinadad&Tobago, Cambodia, Guatemala, El-Salvador, Scotland, Thailand, Ecuador, Hungary, Iran, Germany, Holand-Netherlands, England, Vietnam, Laos, Japan, Dominican-Republic, Canada, Peru, Ireland, Nicaragua, Greece, ?, Outlying-US(Guam-USVI-etc), Columbia}","{Mexico, France, Poland, Yugoslavia, India, Taiwan, Haiti, Portugal, Honduras, Jamaica, Italy, Philippines, Puerto-Rico, Cuba, Trinadad&Tobago, United-States, Cambodia, Guatemala, El-Salvador, Scotland, Thailand, Ecuador, Hungary, Iran, Germany, Holand-Netherlands, England, Vietnam, Laos, Japan, Dominican-Republic, Canada, Peru, Ireland, Nicaragua, Greece, ?, Outlying-US(Guam-USVI-etc), Columbia}","{Mexico, France, Poland, Yugoslavia, India, Taiwan, Haiti, Portugal, Honduras, Jamaica, Italy, Philippines, Puerto-Rico, China, Cuba, Trinadad&Tobago, United-States, Cambodia, Guatemala, El-Salvador, Scotland, Thailand, Ecuador, Hungary, Iran, Germany, Holand-Netherlands, England, Vietnam, Laos, Japan, Dominican-Republic, Canada, Peru, Ireland, Nicaragua, Greece, ?, Outlying-US(Guam-USVI-etc), Columbia}","{Mexico, France, Poland, Yugoslavia, India, Taiwan, Haiti, Portugal, Honduras, Jamaica, Italy, Philippines, Puerto-Rico, China, Cuba, Trinadad&Tobago, United-States, Cambodia, Guatemala, El-Salvador, Scotland, Thailand, Ecuador, Hungary, Iran, Germany, Holand-Netherlands, England, Vietnam, Laos, Japan, Dominican-Republic, Canada, Hong, Peru, Ireland, Nicaragua, Greece, ?, Outlying-US(Guam-USVI-etc), Columbia}",*,*
Guatemala,"{Cambodia, Guatemala, Nicaragua, Yugoslavia, ?, Trinadad&Tobago, Honduras}","{Cambodia, Guatemala, Nicaragua, Yugoslavia, ?, Trinadad&Tobago, Honduras}","{Cambodia, Guatemala, Nicaragua, Yugoslavia, ?, Trinadad&Tobago, Honduras}","{Cambodia, Guatemala, Nicaragua, Yugoslavia, ?, Trinadad&Tobago, Honduras}","{Cambodia, Guatemala, Nicaragua, Yugoslavia, ?, Trinadad&Tobago, Honduras}","{Cambodia, Guatemala, Nicaragua, Yugoslavia, Outlying-US(Guam-USVI-etc), ?, Trinadad&Tobago, Honduras}","{Cambodia, Guatemala, Nicaragua, Holand-Netherlands, Yugoslavia, Outlying-US(Guam-USVI-etc), ?, Trinadad&Tobago, Honduras}","{Cambodia, Guatemala, Dominican-Republic, Nicaragua, Holand-Netherlands, Yugoslavia, Outlying-US(Guam-USVI-etc), ?, Trinadad&Tobago, Honduras}","{Cambodia, Guatemala, El-Salvador, Dominican-Republic, Nicaragua, Holand-Netherlands, Yugoslavia, Outlying-US(Guam-USVI-etc), ?, Trinadad&Tobago, Honduras}","{Cambodia, Guatemala, El-Salvador, Dominican-Republic, Nicaragua, Puerto-Rico, Yugoslavia, Holand-Netherlands, ?, Outlying-US(Guam-USVI-etc), Trinadad&Tobago, Honduras}","{Cambodia, Guatemala, El-Salvador, Dominican-Republic, Nicaragua, Puerto-Rico, Yugoslavia, Holand-Netherlands, ?, Cuba, Outlying-US(Guam-USVI-etc), Trinadad&Tobago, Honduras}","{Cambodia, Mexico, El-Salvador, Dominican-Republic, Guatemala, Nicaragua, Puerto-Rico, Yugoslavia, Holand-Netherlands, ?, Cuba, Outlying-US(Guam-USVI-etc), Trinadad&Tobago, Honduras}","{Cambodia, Mexico, El-Salvador, Dominican-Republic, Guatemala, Nicaragua, Germany, Puerto-Rico, Yugoslavia, Holand-Netherlands, ?, Cuba, Outlying-US(Guam-USVI-etc), Trinadad&Tobago, Honduras}","{Cambodia, Mexico, El-Salvador, Dominican-Republic, Guatemala, Nicaragua, Germany, Poland, Puerto-Rico, Yugoslavia, Holand-Netherlands, ?, Cuba, Outlying-US(Guam-USVI-etc), Trinadad&Tobago, Honduras}","{Cambodia, Mexico, El-Salvador, Dominican-Republic, Guatemala, Nicaragua, Germany, Poland, Puerto-Rico, Yugoslavia, Holand-Netherlands, ?, Greece, Cuba, Outlying-US(Guam-USVI-etc), Trinadad&Tobago, Honduras}","{Cambodia, Mexico, El-Salvador, Dominican-Republic, Guatemala, Nicaragua, Germany, Poland, Puerto-Rico, Yugoslavia, Holand-Netherlands, ?, Greece, Cuba, Outlying-US(Guam-USVI-etc), Trinadad&Tobago, Honduras, Portugal}","{Mexico, Poland, Yugoslavia, Honduras, Portugal, Puerto-Rico, Cuba, Trinadad&Tobago, Cambodia, Guatemala, El-Salvador, Germany, Holand-Netherlands, England, Dominican-Republic, Nicaragua, Greece, ?, Outlying-US(Guam-USVI-etc)}","{Mexico, Poland, Yugoslavia, Honduras, Portugal, Italy, Puerto-Rico, Cuba, Trinadad&Tobago, Cambodia, Guatemala, El-Salvador, Germany, Holand-Netherlands, England, Dominican-Republic, Nicaragua, Greece, ?, Outlying-US(Guam-USVI-etc)}","{Mexico, France, Poland, Yugoslavia, Honduras, Portugal, Italy, Puerto-Rico, Cuba, Trinadad&Tobago, Cambodia, Guatemala, El-Salvador, Germany, Holand-Netherlands, England, Dominican-Republic, Nicaragua, Greece, ?, Outlying-US(Guam-USVI-etc)}","{Mexico, France, Poland, Yugoslavia, Honduras, Portugal, Italy, Puerto-Rico, Cuba, Trinadad&Tobago, Cambodia, Guatemala, El-Salvador, Thailand, Germany, Holand-Netherlands, England, Dominican-Republic, Nicaragua, Greece, ?, Outlying-US(Guam-USVI-etc)}","{Mexico, France, Poland, Yugoslavia, India, Honduras, Portugal, Italy, Puerto-Rico, Cuba, Trinadad&Tobago, Cambodia, Guatemala, El-Salvador, Thailand, Germany, Holand-Netherlands, England, Dominican-Republic, Nicaragua, Greece, ?, Outlying-US(Guam-USVI-etc)}","{Mexico, France, Poland, Yugoslavia, India, Honduras, Portugal, Italy, Puerto-Rico, Cuba, Trinadad&Tobago, Cambodia, Guatemala, El-Salvador, Thailand, Germany, Holand-Netherlands, England, Dominican-Republic, Canada, Nicaragua, Greece, ?, Outlying-US(Guam-USVI-etc)}","{Mexico, France, Poland, Yugoslavia, India, Honduras, Portugal, Italy, Puerto-Rico, Cuba, Trinadad&Tobago, Cambodia, Guatemala, El-Salvador, Thailand, Germany, Holand-Netherlands, England, Dominican-Republic, Canada, Ireland, Nicaragua, Greece, ?, Outlying-US(Guam-USVI-etc)}","{Mexico, France, Poland, Yugoslavia, India, Honduras, Portugal, Italy, Philippines, Puerto-Rico, Cuba, Trinadad&Tobago, Cambodia, Guatemala, El-Salvador, Thailand, Germany, Holand-Netherlands, England, Dominican-Republic, Canada, Ireland, Nicaragua, Greece, ?, Outlying-US(Guam-USVI-etc)}","{Mexico, France, Poland, Yugoslavia, India, Honduras, Portugal, Italy, Philippines, Puerto-Rico, Cuba, Trinadad&Tobago, Cambodia, Guatemala, El-Salvador, Thailand, Germany, Holand-Netherlands, England, Vietnam, Dominican-Republic, Canada, Ireland, Nicaragua, Greece, ?, Outlying-US(Guam-USVI-etc)}","{Mexico, France, Poland, Yugoslavia, India, Honduras, Portugal, Italy, Philippines, Puerto-Rico, Cuba, Trinadad&Tobago, Cambodia, Guatemala, El-Salvador, Thailand, Germany, Holand-Netherlands, England, Vietnam, Japan, Dominican-Republic, Canada, Ireland, Nicaragua, Greece, ?, Outlying-US(Guam-USVI-etc)}","{Mexico, France, Poland, Yugoslavia, India, Honduras, Portugal, Italy, Philippines, Puerto-Rico, Cuba, Trinadad&Tobago, Cambodia, Guatemala, El-Salvador, Thailand, Iran, Germany, Holand-Netherlands, England, Vietnam, Japan, Dominican-Republic, Canada, Ireland, Nicaragua, Greece, ?, Outlying-US(Guam-USVI-etc)}","{Mexico, France, Poland, Yugoslavia, India, Honduras, Portugal, Italy, Philippines, Puerto-Rico, Cuba, Trinadad&Tobago, Cambodia, Guatemala, El-Salvador, Thailand, Iran, Germany, Holand-Netherlands, England, Vietnam, Japan, Dominican-Republic, Canada, Ireland, Nicaragua, Greece, ?, Outlying-US(Guam-USVI-etc), Columbia}","{Mexico, France, Poland, Yugoslavia, India, Honduras, Haiti, Portugal, Italy, Philippines, Puerto-Rico, Cuba, Trinadad&Tobago, Cambodia, Guatemala, El-Salvador, Thailand, Iran, Germany, Holand-Netherlands, England, Vietnam, Japan, Dominican-Republic, Canada, Ireland, Nicaragua, Greece, ?, Outlying-US(Guam-USVI-etc), Columbia}","{Mexico, France, Poland, Yugoslavia, India, Honduras, Haiti, Portugal, Italy, Philippines, Puerto-Rico, Cuba, Trinadad&Tobago, Cambodia, Guatemala, El-Salvador, Thailand, Iran, Germany, Holand-Netherlands, England, Vietnam, Japan, Dominican-Republic, Canada, Peru, Ireland, Nicaragua, Greece, ?, Outlying-US(Guam-USVI-etc), Columbia}","{Mexico, France, Poland, Yugoslavia, India, Honduras, Haiti, Portugal, Jamaica, Italy, Philippines, Puerto-Rico, Cuba, Trinadad&Tobago, Cambodia, Guatemala, El-Salvador, Thailand, Iran, Germany, Holand-Netherlands, England, Vietnam, Japan, Dominican-Republic, Canada, Peru, Ireland, Nicaragua, Greece, ?, Outlying-US(Guam-USVI-etc), Columbia}","{Mexico, France, Poland, Yugoslavia, India, Honduras, Haiti, Portugal, Jamaica, Italy, Philippines, Puerto-Rico, Cuba, Trinadad&Tobago, Cambodia, Guatemala, El-Salvador, Thailand, Hungary, Iran, Germany, Holand-Netherlands, England, Vietnam, Japan, Dominican-Republic, Canada, Peru, Ireland, Nicaragua, Greece, ?, Outlying-US(Guam-USVI-etc), Columbia}","{Mexico, France, Poland, Yugoslavia, India, Honduras, Haiti, Portugal, Jamaica, Italy, Philippines, Puerto-Rico, Cuba, Trinadad&Tobago, Cambodia, Guatemala, El-Salvador, Thailand, Ecuador, Hungary, Iran, Germany, Holand-Netherlands, England, Vietnam, Japan, Dominican-Republic, Canada, Peru, Ireland, Nicaragua, Greece, ?, Outlying-US(Guam-USVI-etc), Columbia}","{Mexico, France, Poland, Yugoslavia, India, Honduras, Haiti, Portugal, Jamaica, Italy, Philippines, Puerto-Rico, Cuba, Trinadad&Tobago, Cambodia, Guatemala, El-Salvador, Scotland, Thailand, Ecuador, Hungary, Iran, Germany, Holand-Netherlands, England, Vietnam, Japan, Dominican-Republic, Canada, Peru, Ireland, Nicaragua, Greece, ?, Outlying-US(Guam-USVI-etc), Columbia}","{Mexico, France, Poland, Yugoslavia, India, Taiwan, Haiti, Portugal, Honduras, Jamaica, Italy, Philippines, Puerto-Rico, Cuba, Trinadad&Tobago, Cambodia, Guatemala, El-Salvador, Scotland, Thailand, Ecuador, Hungary, Iran, Germany, Holand-Netherlands, England, Vietnam, Japan, Dominican-Republic, Canada, Peru, Ireland, Nicaragua, Greece, ?, Outlying-US(Guam-USVI-etc), Columbia}","{Mexico, France, Poland, Yugoslavia, India, Taiwan, Haiti, Portugal, Honduras, Jamaica, Italy, Philippines, Puerto-Rico, Cuba, Trinadad&Tobago, Cambodia, Guatemala, El-Salvador, Scotland, Thailand, Ecuador, Hungary, Iran, Germany, Holand-Netherlands, England, Vietnam, Laos, Japan, Dominican-Republic, Canada, Peru, Ireland, Nicaragua, Greece, ?, Outlying-US(Guam-USVI-etc), Columbia}","{Mexico, France, Poland, Yugoslavia, India, Taiwan, Haiti, Portugal, Honduras, Jamaica, Italy, Philippines, Puerto-Rico, Cuba, Trinadad&Tobago, United-States, Cambodia, Guatemala, El-Salvador, Scotland, Thailand, Ecuador, Hungary, Iran, Germany, Holand-Netherlands, England, Vietnam, Laos, Japan, Dominican-Republic, Canada, Peru, Ireland, Nicaragua, Greece, ?, Outlying-US(Guam-USVI-etc), Columbia}","{Mexico, France, Poland, Yugoslavia, India, Taiwan, Haiti, Portugal, Honduras, Jamaica, Italy, Philippines, Puerto-Rico, China, Cuba, Trinadad&Tobago, United-States, Cambodia, Guatemala, El-Salvador, Scotland, Thailand, Ecuador, Hungary, Iran, Germany, Holand-Netherlands, England, Vietnam, Laos, Japan, Dominican-Republic, Canada, Peru, Ireland, Nicaragua, Greece, ?, Outlying-US(Guam-USVI-etc), Columbia}","{Mexico, France, Poland, Yugoslavia, India, Taiwan, Haiti, Portugal, Honduras, Jamaica, Italy, Philippines, Puerto-Rico, China, Cuba, Trinadad&Tobago, United-States, Cambodia, Guatemala, El-Salvador, Scotland, Thailand, Ecuador, Hungary, Iran, Germany, Holand-Netherlands, England, Vietnam, Laos, Japan, Dominican-Republic, Canada, Hong, Peru, Ireland, Nicaragua, Greece, ?, Outlying-US(Guam-USVI-etc), Columbia}",*,*
