?,"{?}","{?}","{?}","{?}","{?}","{?}","{?}","{?}","{?}","{?}","{?}","{?}","{?}","{?}","{?}","{?}","{?}","{?}","{?}","{?}","{?}","{?}","{?}","{?}","{?}","{?}","{?}","{?}","{?}","{?}","{?}","{?}","{?}","{?}","{?}","{?}","{?}","{?}","{?}","{?}",*
Laos,"{Laos}","{Laos}","{Laos}","{Laos}","{Laos}","{Laos}","{Laos}","{Laos}","{Laos}","{Laos}","{Laos}","{Laos}","{Laos}","{Laos}","{Laos}","{Laos}","{Laos}","{Laos}","{Laos}","{Laos}","{Laos}","{Laos}","{Laos}","{Laos}","{Laos}","{Laos}","{Laos}","{Laos}","{Laos}","{Laos}","{Laos}","{Laos}","{Laos}","{India, England, Cambodia, France, Canada, Ecuador, Puerto-Rico, Peru, Thailand, Italy, Outlying-US(Guam-USVI-etc), Mexico, Laos, Columbia, Nicaragua, Hungary, Poland, El-Salvador, Honduras, Scotland, Jamaica, Taiwan, Guatemala, Germany, United-States, Japan, Greece, China, Philippines, Portugal, Ireland, Cuba, Vietnam, Haiti, Dominican-Republic}","{India, England, Hong, Cambodia, France, Canada, Ecuador, Puerto-Rico, Peru, Thailand, Italy, Outlying-US(Guam-USVI-etc), Mexico, Laos, Columbia, Nicaragua, Hungary, Poland, El-Salvador, Honduras, Scotland, Jamaica, Taiwan, Guatemala, Germany, United-States, Japan, Greece, China, Philippines, Portugal, Ireland, Cuba, Vietnam, Haiti, Dominican-Republic}","{India, England, Hong, Cambodia, France, Canada, Ecuador, Puerto-Rico, Peru, Thailand, Italy, Outlying-US(Guam-USVI-etc), Mexico, Laos, Columbia, Nicaragua, Hungary, Poland, El-Salvador, Iran, Honduras, Scotland, Jamaica, Taiwan, Guatemala, Germany, United-States, Japan, Greece, China, Philippines, Portugal, Ireland, Cuba, Vietnam, Haiti, Dominican-Republic}","{India, England, Hong, Cambodia, France, Canada, Ecuador, Puerto-Rico, Peru, Thailand, Italy, Outlying-US(Guam-USVI-etc), Mexico, Laos, Columbia, Nicaragua, Hungary, Poland, El-Salvador, Iran, Honduras, Scotland, Jamaica, South, Taiwan, Guatemala, Germany, United-States, Japan, Greece, China, Philippines, Portugal, Ireland, Cuba, Vietnam, Haiti, Dominican-Republic}","{India, England, Hong, Cambodia, France, Canada, Ecuador, Puerto-Rico, Peru, Thailand, Italy, Outlying-US(Guam-USVI-etc), Mexico, Laos, Holand-Netherlands, Columbia, Nicaragua, Hungary, Poland, El-Salvador, Iran, Honduras, Scotland, Jamaica, South, Taiwan, Guatemala, Germany, United-States, Japan, Greece, China, Philippines, Portugal, Ireland, Cuba, Vietnam, Haiti, Dominican-Republic}","{India, England, Hong, Cambodia, France, Canada, Ecuador, Puerto-Rico, Peru, Thailand, Italy, Outlying-US(Guam-USVI-etc), Mexico, Laos, Holand-Netherlands, Columbia, Nicaragua, Hungary, Trinadad&Tobago, Poland, El-Salvador, Iran, Honduras, Scotland, Jamaica, South, Taiwan, Guatemala, Germany, United-States, Japan, Greece, China, Philippines, Portugal, Ireland, Cuba, Vietnam, Haiti, Dominican-Republic}","{India, England, Hong, Cambodia, France, Canada, Ecuador, Puerto-Rico, Peru, Thailand, Italy, Outlying-US(Guam-USVI-etc), Mexico, Laos, Holand-Netherlands, Columbia, Nicaragua, Hungary, Trinadad&Tobago, Poland, El-Salvador, Iran, Honduras, Scotland, Jamaica, South, Taiwan, Guatemala, Germany, United-States, Japan, Greece, China, Philippines, Yugoslavia, Portugal, Ireland, Cuba, Vietnam, Haiti, Dominican-Republic}",*
Canada,"{Canada}","{Canada}","{Canada}","{Canada}","{Canada}","{Canada}","{Canada}","{Canada}","{Canada}","{Canada}","{Canada}","{Canada}","{Canada}","{Hungary, Thailand, Taiwan, India, Germany, Poland, Japan, Greece, Cambodia, China, Philippines, France, Canada, Vietnam, England}","{Hungary, Thailand, Taiwan, India, Mexico, Germany, Poland, Japan, Greece, Cambodia, China, Philippines, France, Canada, Vietnam, England}","{Hungary, Thailand, Taiwan, India, Mexico, Germany, Poland, United-States, Japan, Greece, Cambodia, China, Philippines, France, Canada, Vietnam, England}","{Hungary, Thailand, Taiwan, India, Mexico, Germany, Poland, United-States, Japan, Greece, Cambodia, China, Philippines, France, Canada, Vietnam, England}","{Hungary, Thailand, Taiwan, India, Mexico, Germany, Poland, United-States, Japan, Greece, Cambodia, China, Philippines, France, Canada, Vietnam, England}","{Hungary, Thailand, Taiwan, India, Mexico, Germany, Poland, United-States, Japan, Greece, Cambodia, China, Philippines, France, Canada, Vietnam, England}","{Hungary, Thailand, Taiwan, India, Mexico, Germany, Poland, United-States, Japan, Greece, Cambodia, China, Philippines, France, Canada, Vietnam, England}","{Hungary, Thailand, Taiwan, India, Mexico, Germany, Poland, United-States, Japan, Greece, Cambodia, China, Philippines, France, Canada, Vietnam, England}","{India, Cambodia, France, Canada, Thailand, Mexico, Nicaragua, Hungary, Poland, El-Salvador, Honduras, Jamaica, Taiwan, Guatemala, Germany, United-States, Japan, Greece, China, Philippines, Vietnam, England, Dominican-Republic}","{India, England, Cambodia, France, Canada, Thailand, Mexico, Nicaragua, Hungary, Poland, El-Salvador, Honduras, Jamaica, Taiwan, Guatemala, Germany, United-States, Japan, Greece, China, Philippines, Vietnam, Haiti, Dominican-Republic}","{India, England, Cambodia, France, Canada, Puerto-Rico, Thailand, Mexico, Nicaragua, Hungary, Poland, El-Salvador, Honduras, Jamaica, Taiwan, Guatemala, Germany, United-States, Japan, Greece, China, Philippines, Vietnam, Haiti, Dominican-Republic}","{India, England, Cambodia, France, Canada, Puerto-Rico, Thailand, Outlying-US(Guam-USVI-etc), Mexico, Nicaragua, Hungary, Poland, El-Salvador, Honduras, Jamaica, Taiwan, Guatemala, Germany, United-States, Japan, Greece, China, Philippines, Vietnam, Haiti, Dominican-Republic}","{India, England, Cambodia, France, Canada, Puerto-Rico, Thailand, Outlying-US(Guam-USVI-etc), Mexico, Nicaragua, Hungary, Poland, El-Salvador, Honduras, Jamaica, Taiwan, Guatemala, Germany, United-States, Japan, Greece, China, Philippines, Vietnam, Haiti, Dominican-Republic}","{India, England, Cambodia, France, Canada, Puerto-Rico, Thailand, Outlying-US(Guam-USVI-etc), Mexico, Nicaragua, Hungary, Poland, El-Salvador, Honduras, Jamaica, Taiwan, Guatemala, Germany, United-States, Japan, Greece, China, Philippines, Vietnam, Haiti, Dominican-Republic}","{India, England, Cambodia, France, Canada, Puerto-Rico, Thailand, Outlying-US(Guam-USVI-etc), Mexico, Nicaragua, Hungary, Poland, El-Salvador, Honduras, Jamaica, Taiwan, Guatemala, Germany, United-States, Japan, Greece, China, Philippines, Vietnam, Haiti, Dominican-Republic}","{India, England, Cambodia, France, Canada, Puerto-Rico, Thailand, Italy, Outlying-US(Guam-USVI-etc), Mexico, Nicaragua, Hungary, Poland, El-Salvador, Honduras, Scotland, Jamaica, Taiwan, Guatemala, Germany, United-States, Japan, Greece, China, Philippines, Portugal, Ireland, Vietnam, Haiti, Dominican-Republic}","{India, England, Cambodia, France, Canada, Ecuador, Puerto-Rico, Thailand, Italy, Outlying-US(Guam-USVI-etc), Mexico, Nicaragua, Hungary, Poland, El-Salvador, Honduras, Scotland, Jamaica, Taiwan, Guatemala, Germany, United-States, Japan, Greece, China, Philippines, Portugal, Ireland, Vietnam, Haiti, Dominican-Republic}","{India, England, Cambodia, France, Canada, Ecuador, Puerto-Rico, Thailand, Italy, Outlying-US(Guam-USVI-etc), Mexico, Columbia, Nicaragua, Hungary, Poland, El-Salvador, Honduras, Scotland, Jamaica, Taiwan, Guatemala, Germany, United-States, Japan, Greece, China, Philippines, Portugal, Ireland, Vietnam, Haiti, Dominican-Republic}","{India, England, Cambodia, France, Canada, Ecuador, Puerto-Rico, Thailand, Italy, Outlying-US(Guam-USVI-etc), Mexico, Columbia, Nicaragua, Hungary, Poland, El-Salvador, Honduras, Scotland, Jamaica, Taiwan, Guatemala, Germany, United-States, Japan, Greece, China, Philippines, Portugal, Ireland, Cuba, Vietnam, Haiti, Dominican-Republic}","{India, England, Cambodia, France, Canada, Ecuador, Puerto-Rico, Peru, Thailand, Italy, Outlying-US(Guam-USVI-etc), Mexico, Columbia, Nicaragua, Hungary, Poland, El-Salvador, Honduras, Scotland, Jamaica, Taiwan, Guatemala, Germany, United-States, Japan, Greece, China, Philippines, Portugal, Ireland, Cuba, Vietnam, Haiti, Dominican-Republic}","{India, England, Cambodia, France, Canada, Ecuador, Puerto-Rico, Peru, Thailand, Italy, Outlying-US(Guam-USVI-etc), Mexico, Laos, Columbia, Nicaragua, Hungary, Poland, El-Salvador, Honduras, Scotland, Jamaica, Taiwan, Guatemala, Germany, United-States, Japan, Greece, China, Philippines, Portugal, Ireland, Cuba, Vietnam, Haiti, Dominican-Republic}","{India, England, Hong, Cambodia, France, Canada, Ecuador, Puerto-Rico, Peru, Thailand, Italy, Outlying-US(Guam-USVI-etc), Mexico, Laos, Columbia, Nicaragua, Hungary, Poland, El-Salvador, Honduras, Scotland, Jamaica, Taiwan, Guatemala, Germany, United-States, Japan, Greece, China, Philippines, Portugal, Ireland, Cuba, Vietnam, Haiti, Dominican-Republic}","{India, England, Hong, Cambodia, France, Canada, Ecuador, Puerto-Rico, Peru, Thailand, Italy, Outlying-US(Guam-USVI-etc), Mexico, Laos, Columbia, Nicaragua, Hungary, Poland, El-Salvador, Iran, Honduras, Scotland, Jamaica, Taiwan, Guatemala, Germany, United-States, Japan, Greece, China, Philippines, Portugal, Ireland, Cuba, Vietnam, Haiti, Dominican-Republic}","{India, England, Hong, Cambodia, France, Canada, Ecuador, Puerto-Rico, Peru, Thailand, Italy, Outlying-US(Guam-USVI-etc), Mexico, Laos, Columbia, Nicaragua, Hungary, Poland, El-Salvador, Iran, Honduras, Scotland, Jamaica, South, Taiwan, Guatemala, Germany, United-States, Japan, Greece, China, Philippines, Portugal, Ireland, Cuba, Vietnam, Haiti, Dominican-Republic}","{India, England, Hong, Cambodia, France, Canada, Ecuador, Puerto-Rico, Peru, Thailand, Italy, Outlying-US(Guam-USVI-etc), Mexico, Laos, Holand-Netherlands, Columbia, Nicaragua, Hungary, Poland, El-Salvador, Iran, Honduras, Scotland, Jamaica, South, Taiwan, Guatemala, Germany, United-States, Japan, Greece, China, Philippines, Portugal, Ireland, Cuba, Vietnam, Haiti, Dominican-Republic}","{India, England, Hong, Cambodia, France, Canada, Ecuador, Puerto-Rico, Peru, Thailand, Italy, Outlying-US(Guam-USVI-etc), Mexico, Laos, Holand-Netherlands, Columbia, Nicaragua, Hungary, Trinadad&Tobago, Poland, El-Salvador, Iran, Honduras, Scotland, Jamaica, South, Taiwan, Guatemala, Germany, United-States, Japan, Greece, China, Philippines, Portugal, Ireland, Cuba, Vietnam, Haiti, Dominican-Republic}","{India, England, Hong, Cambodia, France, Canada, Ecuador, Puerto-Rico, Peru, Thailand, Italy, Outlying-US(Guam-USVI-etc), Mexico, Laos, Holand-Netherlands, Columbia, Nicaragua, Hungary, Trinadad&Tobago, Poland, El-Salvador, Iran, Honduras, Scotland, Jamaica, South, Taiwan, Guatemala, Germany, United-States, Japan, Greece, China, Philippines, Yugoslavia, Portugal, Ireland, Cuba, Vietnam, Haiti, Dominican-Republic}",*
England,"{England}","{England}","{England}","{England}","{England}","{England}","{England}","{England}","{England}","{England}","{Hungary, Germany, Poland, Greece, France, England}","{Hungary, Thailand, Taiwan, Germany, Poland, Japan, Greece, Cambodia, China, Philippines, France, Vietnam, England}","{Hungary, Thailand, Taiwan, India, Germany, Poland, Japan, Greece, Cambodia, China, Philippines, France, Vietnam, England}","{Hungary, Thailand, Taiwan, India, Germany, Poland, Japan, Greece, Cambodia, China, Philippines, France, Canada, Vietnam, England}","{Hungary, Thailand, Taiwan, India, Mexico, Germany, Poland, Japan, Greece, Cambodia, China, Philippines, France, Canada, Vietnam, England}","{Hungary, Thailand, Taiwan, India, Mexico, Germany, Poland, United-States, Japan, Greece, Cambodia, China, Philippines, France, Canada, Vietnam, England}","{Hungary, Thailand, Taiwan, India, Mexico, Germany, Poland, United-States, Japan, Greece, Cambodia, China, Philippines, France, Canada, Vietnam, England}","{Hungary, Thailand, Taiwan, India, Mexico, Germany, Poland, United-States, Japan, Greece, Cambodia, China, Philippines, France, Canada, Vietnam, England}","{Hungary, Thailand, Taiwan, India, Mexico, Germany, Poland, United-States, Japan, Greece, Cambodia, China, Philippines, France, Canada, Vietnam, England}","{Hungary, Thailand, Taiwan, India, Mexico, Germany, Poland, United-States, Japan, Greece, Cambodia, China, Philippines, France, Canada, Vietnam, England}","{Hungary, Thailand, Taiwan, India, Mexico, Germany, Poland, United-States, Japan, Greece, Cambodia, China, Philippines, France, Canada, Vietnam, England}","{India, Cambodia, France, Canada, Thailand, Mexico, Nicaragua, Hungary, Poland, El-Salvador, Honduras, Jamaica, Taiwan, Guatemala, Germany, United-States, Japan, Greece, China, Philippines, Vietnam, England, Dominican-Republic}","{India, England, Cambodia, France, Canada, Thailand, Mexico, Nicaragua, Hungary, Poland, El-Salvador, Honduras, Jamaica, Taiwan, Guatemala, Germany, United-States, Japan, Greece, China, Philippines, Vietnam, Haiti, Dominican-Republic}","{India, England, Cambodia, France, Canada, Puerto-Rico, Thailand, Mexico, Nicaragua, Hungary, Poland, El-Salvador, Honduras, Jamaica, Taiwan, Guatemala, Germany, United-States, Japan, Greece, China, Philippines, Vietnam, Haiti, Dominican-Republic}","{India, England, Cambodia, France, Canada, Puerto-Rico, Thailand, Outlying-US(Guam-USVI-etc), Mexico, Nicaragua, Hungary, Poland, El-Salvador, Honduras, Jamaica, Taiwan, Guatemala, Germany, United-States, Japan, Greece, China, Philippines, Vietnam, Haiti, Dominican-Republic}","{India, England, Cambodia, France, Canada, Puerto-Rico, Thailand, Outlying-US(Guam-USVI-etc), Mexico, Nicaragua, Hungary, Poland, El-Salvador, Honduras, Jamaica, Taiwan, Guatemala, Germany, United-States, Japan, Greece, China, Philippines, Vietnam, Haiti, Dominican-Republic}","{India, England, Cambodia, France, Canada, Puerto-Rico, Thailand, Outlying-US(Guam-USVI-etc), Mexico, Nicaragua, Hungary, Poland, El-Salvador, Honduras, Jamaica, Taiwan, Guatemala, Germany, United-States, Japan, Greece, China, Philippines, Vietnam, Haiti, Dominican-Republic}","{India, England, Cambodia, France, Canada, Puerto-Rico, Thailand, Outlying-US(Guam-USVI-etc), Mexico, Nicaragua, Hungary, Poland, El-Salvador, Honduras, Jamaica, Taiwan, Guatemala, Germany, United-States, Japan, Greece, China, Philippines, Vietnam, Haiti, Dominican-Republic}","{India, England, Cambodia, France, Canada, Puerto-Rico, Thailand, Italy, Outlying-US(Guam-USVI-etc), Mexico, Nicaragua, Hungary, Poland, El-Salvador, Honduras, Scotland, Jamaica, Taiwan, Guatemala, Germany, United-States, Japan, Greece, China, Philippines, Portugal, Ireland, Vietnam, Haiti, Dominican-Republic}","{India, England, Cambodia, France, Canada, Ecuador, Puerto-Rico, Thailand, Italy, Outlying-US(Guam-USVI-etc), Mexico, Nicaragua, Hungary, Poland, El-Salvador, Honduras, Scotland, Jamaica, Taiwan, Guatemala, Germany, United-States, Japan, Greece, China, Philippines, Portugal, Ireland, Vietnam, Haiti, Dominican-Republic}","{India, England, Cambodia, France, Canada, Ecuador, Puerto-Rico, Thailand, Italy, Outlying-US(Guam-USVI-etc), Mexico, Columbia, Nicaragua, Hungary, Poland, El-Salvador, Honduras, Scotland, Jamaica, Taiwan, Guatemala, Germany, United-States, Japan, Greece, China, Philippines, Portugal, Ireland, Vietnam, Haiti, Dominican-Republic}","{India, England, Cambodia, France, Canada, Ecuador, Puerto-Rico, Thailand, Italy, Outlying-US(Guam-USVI-etc), Mexico, Columbia, Nicaragua, Hungary, Poland, El-Salvador, Honduras, Scotland, Jamaica, Taiwan, Guatemala, Germany, United-States, Japan, Greece, China, Philippines, Portugal, Ireland, Cuba, Vietnam, Haiti, Dominican-Republic}","{India, England, Cambodia, France, Canada, Ecuador, Puerto-Rico, Peru, Thailand, Italy, Outlying-US(Guam-USVI-etc), Mexico, Columbia, Nicaragua, Hungary, Poland, El-Salvador, Honduras, Scotland, Jamaica, Taiwan, Guatemala, Germany, United-States, Japan, Greece, China, Philippines, Portugal, Ireland, Cuba, Vietnam, Haiti, Dominican-Republic}","{India, England, Cambodia, France, Canada, Ecuador, Puerto-Rico, Peru, Thailand, Italy, Outlying-US(Guam-USVI-etc), Mexico, Laos, Columbia, Nicaragua, Hungary, Poland, El-Salvador, Honduras, Scotland, Jamaica, Taiwan, Guatemala, Germany, United-States, Japan, Greece, China, Philippines, Portugal, Ireland, Cuba, Vietnam, Haiti, Dominican-Republic}","{India, England, Hong, Cambodia, France, Canada, Ecuador, Puerto-Rico, Peru, Thailand, Italy, Outlying-US(Guam-USVI-etc), Mexico, Laos, Columbia, Nicaragua, Hungary, Poland, El-Salvador, Honduras, Scotland, Jamaica, Taiwan, Guatemala, Germany, United-States, Japan, Greece, China, Philippines, Portugal, Ireland, Cuba, Vietnam, Haiti, Dominican-Republic}","{India, England, Hong, Cambodia, France, Canada, Ecuador, Puerto-Rico, Peru, Thailand, Italy, Outlying-US(Guam-USVI-etc), Mexico, Laos, Columbia, Nicaragua, Hungary, Poland, El-Salvador, Iran, Honduras, Scotland, Jamaica, Taiwan, Guatemala, Germany, United-States, Japan, Greece, China, Philippines, Portugal, Ireland, Cuba, Vietnam, Haiti, Dominican-Republic}","{India, England, Hong, Cambodia, France, Canada, Ecuador, Puerto-Rico, Peru, Thailand, Italy, Outlying-US(Guam-USVI-etc), Mexico, Laos, Columbia, Nicaragua, Hungary, Poland, El-Salvador, Iran, Honduras, Scotland, Jamaica, South, Taiwan, Guatemala, Germany, United-States, Japan, Greece, China, Philippines, Portugal, Ireland, Cuba, Vietnam, Haiti, Dominican-Republic}","{India, England, Hong, Cambodia, France, Canada, Ecuador, Puerto-Rico, Peru, Thailand, Italy, Outlying-US(Guam-USVI-etc), Mexico, Laos, Holand-Netherlands, Columbia, Nicaragua, Hungary, Poland, El-Salvador, Iran, Honduras, Scotland, Jamaica, South, Taiwan, Guatemala, Germany, United-States, Japan, Greece, China, Philippines, Portugal, Ireland, Cuba, Vietnam, Haiti, Dominican-Republic}","{India, England, Hong, Cambodia, France, Canada, Ecuador, Puerto-Rico, Peru, Thailand, Italy, Outlying-US(Guam-USVI-etc), Mexico, Laos, Holand-Netherlands, Columbia, Nicaragua, Hungary, Trinadad&Tobago, Poland, El-Salvador, Iran, Honduras, Scotland, Jamaica, South, Taiwan, Guatemala, Germany, United-States, Japan, Greece, China, Philippines, Portugal, Ireland, Cuba, Vietnam, Haiti, Dominican-Republic}","{India, England, Hong, Cambodia, France, Canada, Ecuador, Puerto-Rico, Peru, Thailand, Italy, Outlying-US(Guam-USVI-etc), Mexico, Laos, Holand-Netherlands, Columbia, Nicaragua, Hungary, Trinadad&Tobago, Poland, El-Salvador, Iran, Honduras, Scotland, Jamaica, South, Taiwan, Guatemala, Germany, United-States, Japan, Greece, China, Philippines, Yugoslavia, Portugal, Ireland, Cuba, Vietnam, Haiti, Dominican-Republic}",*
Ecuador,"{Ecuador}","{Ecuador}","{Ecuador}","{Ecuador}","{Ecuador}","{Ecuador}","{Ecuador}","{Ecuador}","{Ecuador}","{Ecuador}","{Ecuador}","{Ecuador}","{Ecuador}","{Ecuador}","{Ecuador}","{Ecuador}","{Ecuador}","{Ecuador}","{Ecuador}","{Ecuador}","{Ecuador}","{Ecuador}","{Ecuador}","{Ecuador}","{Ecuador}","{Ecuador}","{Ecuador}","{Ecuador}","{Ecuador}","{India, England, Cambodia, France, Canada, Ecuador, Puerto-Rico, Thailand, Italy, Outlying-US(Guam-USVI-etc), Mexico, Nicaragua, Hungary, Poland, El-Salvador, Honduras, Scotland, Jamaica, Taiwan, Guatemala, Germany, United-States, Japan, Greece, China, Philippines, Portugal, Ireland, Vietnam, Haiti, Dominican-Republic}","{India, England, Cambodia, France, Canada, Ecuador, Puerto-Rico, Thailand, Italy, Outlying-US(Guam-USVI-etc), Mexico, Columbia, Nicaragua, Hungary, Poland, El-Salvador, Honduras, Scotland, Jamaica, Taiwan, Guatemala, Germany, United-States, Japan, Greece, China, Philippines, Portugal, Ireland, Vietnam, Haiti, Dominican-Republic}","{India, England, Cambodia, France, Canada, Ecuador, Puerto-Rico, Thailand, Italy, Outlying-US(Guam-USVI-etc), Mexico, Columbia, Nicaragua, Hungary, Poland, El-Salvador, Honduras, Scotland, Jamaica, Taiwan, Guatemala, Germany, United-States, Japan, Greece, China, Philippines, Portugal, Ireland, Cuba, Vietnam, Haiti, Dominican-Republic}","{India, England, Cambodia, France, Canada, Ecuador, Puerto-Rico, Peru, Thailand, Italy, Outlying-US(Guam-USVI-etc), Mexico, Columbia, Nicaragua, Hungary, Poland, El-Salvador, Honduras, Scotland, Jamaica, Taiwan, Guatemala, Germany, United-States, Japan, Greece, China, Philippines, Portugal, Ireland, Cuba, Vietnam, Haiti, Dominican-Republic}","{India, England, Cambodia, France, Canada, Ecuador, Puerto-Rico, Peru, Thailand, Italy, Outlying-US(Guam-USVI-etc), Mexico, Laos, Columbia, Nicaragua, Hungary, Poland, El-Salvador, Honduras, Scotland, Jamaica, Taiwan, Guatemala, Germany, United-States, Japan, Greece, China, Philippines, Portugal, Ireland, Cuba, Vietnam, Haiti, Dominican-Republic}","{India, England, Hong, Cambodia, France, Canada, Ecuador, Puerto-Rico, Peru, Thailand, Italy, Outlying-US(Guam-USVI-etc), Mexico, Laos, Columbia, Nicaragua, Hungary, Poland, El-Salvador, Honduras, Scotland, Jamaica, Taiwan, Guatemala, Germany, United-States, Japan, Greece, China, Philippines, Portugal, Ireland, Cuba, Vietnam, Haiti, Dominican-Republic}","{India, England, Hong, Cambodia, France, Canada, Ecuador, Puerto-Rico, Peru, Thailand, Italy, Outlying-US(Guam-USVI-etc), Mexico, Laos, Columbia, Nicaragua, Hungary, Poland, El-Salvador, Iran, Honduras, Scotland, Jamaica, Taiwan, Guatemala, Germany, United-States, Japan, Greece, China, Philippines, Portugal, Ireland, Cuba, Vietnam, Haiti, Dominican-Republic}","{India, England, Hong, Cambodia, France, Canada, Ecuador, Puerto-Rico, Peru, Thailand, Italy, Outlying-US(Guam-USVI-etc), Mexico, Laos, Columbia, Nicaragua, Hungary, Poland, El-Salvador, Iran, Honduras, Scotland, Jamaica, South, Taiwan, Guatemala, Germany, United-States, Japan, Greece, China, Philippines, Portugal, Ireland, Cuba, Vietnam, Haiti, Dominican-Republic}","{India, England, Hong, Cambodia, France, Canada, Ecuador, Puerto-Rico, Peru, Thailand, Italy, Outlying-US(Guam-USVI-etc), Mexico, Laos, Holand-Netherlands, Columbia, Nicaragua, Hungary, Poland, El-Salvador, Iran, Honduras, Scotland, Jamaica, South, Taiwan, Guatemala, Germany, United-States, Japan, Greece, China, Philippines, Portugal, Ireland, Cuba, Vietnam, Haiti, Dominican-Republic}","{India, England, Hong, Cambodia, France, Canada, Ecuador, Puerto-Rico, Peru, Thailand, Italy, Outlying-US(Guam-USVI-etc), Mexico, Laos, Holand-Netherlands, Columbia, Nicaragua, Hungary, Trinadad&Tobago, Poland, El-Salvador, Iran, Honduras, Scotland, Jamaica, South, Taiwan, Guatemala, Germany, United-States, Japan, Greece, China, Philippines, Portugal, Ireland, Cuba, Vietnam, Haiti, Dominican-Republic}","{India, England, Hong, Cambodia, France, Canada, Ecuador, Puerto-Rico, Peru, Thailand, Italy, Outlying-US(Guam-USVI-etc), Mexico, Laos, Holand-Netherlands, Columbia, Nicaragua, Hungary, Trinadad&Tobago, Poland, El-Salvador, Iran, Honduras, Scotland, Jamaica, South, Taiwan, Guatemala, Germany, United-States, Japan, Greece, China, Philippines, Yugoslavia, Portugal, Ireland, Cuba, Vietnam, Haiti, Dominican-Republic}",*
